{
  "id": "gruvbox-dark",
  "name": "Gruvbox Dark",
  "family": "gruvbox",
  "mode": "dark",
  "source": "https://github.com/morhetz/gruvbox",
  "colors": {
    "bg": "#282828",
    "surface": "#3c3836",
    "text": "#ebdbb2",
    "heading": "#fbf1c7",
    "muted": "#928374",
    "border": "#504945",
    "accent": "#83a598",
    "accentAlt": "#d3869b",
    "codeBg": "#32302f",
    "codeText": "#ebdbb2",
    "syntax": {
      "string": "#b8bb26",
      "comment": "#928374",
      "constant": "#d3869b",
      "keyword": "#fb4934",
      "parameter": "#fabd2f",
      "function": "#8ec07c",
      "stringExpression": "#fe8019",
      "punctuation": "#a89984",
      "link": "#83a598",
      "inserted": "#b8bb26",
      "deleted": "#fb4934",
      "changed": "#d79921"
    }
  }
}
